{
  "books": [
    {
      "id": "a1b2c3d4-1111-4a8b-9c2d-000000000001",
      "title": "Biology",
      "chapters": [
        {
          "id": "b1c2d3e4-1111-4a8b-9c2d-000000000011",
          "nr": "1",
          "title": "Cells and Microscopy",
          "questions": [
            {
              "id": "c1d2e3f4-1111-4a8b-9c2d-000000000111",
              "question": "<p>What is the main function of the cell membrane?</p>",
              "answer": "<p>It controls what enters and leaves the cell.</p>",
              "pageNr": "1"
            },
            {
              "id": "c1d2e3f4-1111-4a8b-9c2d-000000000112",
              "question": "<p>Which organelle produces ATP?</p>",
              "answer": "<p>The mitochondrion produces ATP.</p>",
              "pageNr": "2"
            },
            {
              "id": "c1d2e3f4-1111-4a8b-9c2d-000000000113",
              "question": "<p>What does the nucleus contain?</p>",
              "answer": "<p>It contains the cell’s DNA.</p>",
              "pageNr": "2"
            },
            {
              "id": "c1d2e3f4-1111-4a8b-9c2d-000000000114",
              "question": "<p>What is the role of ribosomes?</p>",
              "answer": "<p>They synthesize proteins.</p>",
              "pageNr": "3"
            },
            {
              "id": "c1d2e3f4-1111-4a8b-9c2d-000000000115",
              "question": "<p>Which microscope uses light to view cells?</p>",
              "answer": "<p>The light microscope uses visible light.</p>",
              "pageNr": "3"
            },
            {
              "id": "c1d2e3f4-1111-4a8b-9c2d-000000000116",
              "question": "<p>What is cytoplasm?</p>",
              "answer": "<p>It is the fluid where organelles are suspended.</p>",
              "pageNr": "4"
            },
            {
              "id": "c1d2e3f4-1111-4a8b-9c2d-000000000117",
              "question": "<p>What is the function of the cell wall in plants?</p>",
              "answer": "<p>It provides support and protection.</p>",
              "pageNr": "4"
            },
            {
              "id": "c1d2e3f4-1111-4a8b-9c2d-000000000118",
              "question": "<p>What does the Golgi apparatus do?</p>",
              "answer": "<p>It modifies and packages proteins.</p>",
              "pageNr": "5"
            },
            {
              "id": "c1d2e3f4-1111-4a8b-9c2d-000000000119",
              "question": "<p>Which organelle is responsible for photosynthesis?</p>",
              "answer": "<p>The chloroplast performs photosynthesis.</p>",
              "pageNr": "5"
            },
            {
              "id": "c1d2e3f4-1111-4a8b-9c2d-000000000120",
              "question": "<p>What is diffusion?</p>",
              "answer": "<p>It is movement from high to low concentration.</p>",
              "pageNr": "6"
            }
          ]
        },
        {
          "id": "b1c2d3e4-1111-4a8b-9c2d-000000000012",
          "nr": "2",
          "title": "Genetics",
          "questions": [
            {
              "id": "c1d2e3f4-1111-4a8b-9c2d-000000000121",
              "question": "<p>What is a gene?</p>",
              "answer": "<p>A gene is a segment of DNA with instructions.</p>",
              "pageNr": "7"
            },
            {
              "id": "c1d2e3f4-1111-4a8b-9c2d-000000000122",
              "question": "<p>What are alleles?</p>",
              "answer": "<p>They are different forms of a gene.</p>",
              "pageNr": "7"
            },
            {
              "id": "c1d2e3f4-1111-4a8b-9c2d-000000000123",
              "question": "<p>What does dominant mean in genetics?</p>",
              "answer": "<p>A dominant allele masks a recessive allele.</p>",
              "pageNr": "8"
            },
            {
              "id": "c1d2e3f4-1111-4a8b-9c2d-000000000124",
              "question": "<p>What is a phenotype?</p>",
              "answer": "<p>It is the observable trait.</p>",
              "pageNr": "8"
            },
            {
              "id": "c1d2e3f4-1111-4a8b-9c2d-000000000125",
              "question": "<p>What is a genotype?</p>",
              "answer": "<p>It is the genetic makeup for a trait.</p>",
              "pageNr": "9"
            },
            {
              "id": "c1d2e3f4-1111-4a8b-9c2d-000000000126",
              "question": "<p>What does DNA stand for?</p>",
              "answer": "<p>Deoxyribonucleic acid.</p>",
              "pageNr": "9"
            },
            {
              "id": "c1d2e3f4-1111-4a8b-9c2d-000000000127",
              "question": "<p>What is a chromosome?</p>",
              "answer": "<p>It is a DNA-protein structure carrying genes.</p>",
              "pageNr": "10"
            },
            {
              "id": "c1d2e3f4-1111-4a8b-9c2d-000000000128",
              "question": "<p>What is meiosis?</p>",
              "answer": "<p>It is cell division that forms gametes.</p>",
              "pageNr": "10"
            },
            {
              "id": "c1d2e3f4-1111-4a8b-9c2d-000000000129",
              "question": "<p>What is a Punnett square used for?</p>",
              "answer": "<p>It predicts genetic cross outcomes.</p>",
              "pageNr": "11"
            },
            {
              "id": "c1d2e3f4-1111-4a8b-9c2d-000000000130",
              "question": "<p>What is mutation?</p>",
              "answer": "<p>A mutation is a change in DNA sequence.</p>",
              "pageNr": "11"
            }
          ]
        },
        {
          "id": "b1c2d3e4-1111-4a8b-9c2d-000000000013",
          "nr": "3",
          "title": "Ecology",
          "questions": [
            {
              "id": "c1d2e3f4-1111-4a8b-9c2d-000000000131",
              "question": "<p>What is an ecosystem?</p>",
              "answer": "<p>It is a community of organisms and their environment.</p>",
              "pageNr": "12"
            },
            {
              "id": "c1d2e3f4-1111-4a8b-9c2d-000000000132",
              "question": "<p>What are producers?</p>",
              "answer": "<p>They are organisms that make their own food.</p>",
              "pageNr": "12"
            },
            {
              "id": "c1d2e3f4-1111-4a8b-9c2d-000000000133",
              "question": "<p>What are consumers?</p>",
              "answer": "<p>They obtain energy by eating other organisms.</p>",
              "pageNr": "13"
            },
            {
              "id": "c1d2e3f4-1111-4a8b-9c2d-000000000134",
              "question": "<p>What is a food chain?</p>",
              "answer": "<p>It shows energy flow between organisms.</p>",
              "pageNr": "13"
            },
            {
              "id": "c1d2e3f4-1111-4a8b-9c2d-000000000135",
              "question": "<p>What is a food web?</p>",
              "answer": "<p>It is a network of interconnected food chains.</p>",
              "pageNr": "14"
            },
            {
              "id": "c1d2e3f4-1111-4a8b-9c2d-000000000136",
              "question": "<p>What is biodiversity?</p>",
              "answer": "<p>It is the variety of life in an area.</p>",
              "pageNr": "14"
            },
            {
              "id": "c1d2e3f4-1111-4a8b-9c2d-000000000137",
              "question": "<p>What is a niche?</p>",
              "answer": "<p>It is the role of a species in its environment.</p>",
              "pageNr": "15"
            },
            {
              "id": "c1d2e3f4-1111-4a8b-9c2d-000000000138",
              "question": "<p>What is population density?</p>",
              "answer": "<p>It is the number of individuals per area.</p>",
              "pageNr": "15"
            },
            {
              "id": "c1d2e3f4-1111-4a8b-9c2d-000000000139",
              "question": "<p>What is carrying capacity?</p>",
              "answer": "<p>It is the maximum population an area supports.</p>",
              "pageNr": "16"
            },
            {
              "id": "c1d2e3f4-1111-4a8b-9c2d-000000000140",
              "question": "<p>What is succession?</p>",
              "answer": "<p>It is gradual change in ecosystems over time.</p>",
              "pageNr": "16"
            }
          ]
        },
        {
          "id": "b1c2d3e4-1111-4a8b-9c2d-000000000014",
          "nr": "4",
          "title": "Human Body Systems",
          "questions": [
            {
              "id": "c1d2e3f4-1111-4a8b-9c2d-000000000141",
              "question": "<p>What is the function of the circulatory system?</p>",
              "answer": "<p>It transports blood, oxygen, and nutrients.</p>",
              "pageNr": "17"
            },
            {
              "id": "c1d2e3f4-1111-4a8b-9c2d-000000000142",
              "question": "<p>What is the main organ of the respiratory system?</p>",
              "answer": "<p>The lungs are the main organ.</p>",
              "pageNr": "17"
            },
            {
              "id": "c1d2e3f4-1111-4a8b-9c2d-000000000143",
              "question": "<p>What does the digestive system do?</p>",
              "answer": "<p>It breaks down food and absorbs nutrients.</p>",
              "pageNr": "18"
            },
            {
              "id": "c1d2e3f4-1111-4a8b-9c2d-000000000144",
              "question": "<p>What is the function of the nervous system?</p>",
              "answer": "<p>It coordinates body responses and actions.</p>",
              "pageNr": "18"
            },
            {
              "id": "c1d2e3f4-1111-4a8b-9c2d-000000000145",
              "question": "<p>What does the skeletal system provide?</p>",
              "answer": "<p>It provides support and protection.</p>",
              "pageNr": "19"
            },
            {
              "id": "c1d2e3f4-1111-4a8b-9c2d-000000000146",
              "question": "<p>What is the role of the immune system?</p>",
              "answer": "<p>It defends the body against pathogens.</p>",